<?xml version="1.0" encoding="utf-8"?>

<profiles xmlns:xsi="http://www.w3.org/2001/XMLSchema-instance" xsi:noNamespaceSchemaLocation="zigbee.xsd">
    <profile id="0xc05e" name="ZigBee Light Link Profile">
        <xi:include href="zcl.xml" xmlns:xi="http://www.w3.org/2001/XInclude"/>
        <device id="0x0000" name="On/Off Light">
            <server>
                <clusterRef name="Basic" mandatory="true"/>
                <clusterRef name="Identify" mandatory="true"/>
                <clusterRef name="On/Off" mandatory="true"/>
                <clusterRef name="Scenes" mandatory="true"/>
                <clusterRef name="Groups" mandatory="true"/>
            </server>
        </device>
        <device id="0x0100" name="Dimmable Light">
            <server>
                <clusterRef name="Basic" mandatory="true"/>
                <clusterRef name="Identify" mandatory="true"/>
                <clusterRef name="On/Off" mandatory="true"/>
                <clusterRef name="Level Control" mandatory="true"/>
                <clusterRef name="Scenes" mandatory="true"/>
                <clusterRef name="Groups" mandatory="true"/>
            </server>
        </device>
        <device id="0x0200" name="Color Light">
            <server>
                <clusterRef name="Basic" mandatory="true"/>
                <clusterRef name="Identify" mandatory="true"/>
                <clusterRef name="On/Off" mandatory="true"/>
                <clusterRef name="Level Control" mandatory="true"/>
                <clusterRef name="Color Control" mandatory="true"/>
                <clusterRef name="Scenes" mandatory="true"/>
                <clusterRef name="Groups" mandatory="true"/>
            </server>
        </device>
        <device id="0x0210" name="Ext Color Light">
            <server>
                <clusterRef name="Basic" mandatory="true"/>
                <clusterRef name="Identify" mandatory="true"/>
                <clusterRef name="On/Off" mandatory="true"/>
                <clusterRef name="Level Control" mandatory="true"/>
                <clusterRef name="Color Control" mandatory="true"/>
                <clusterRef name="Scenes" mandatory="true"/>
                <clusterRef name="Groups" mandatory="true"/>
            </server>
        </device>
    </profile>
</profiles>
